<?xml version="1.0" encoding="UTF-8"?>
<personas xmlns:xsi="http://www.w3.org/2001/XMLSchema-instance" xsi:noNamespaceSchemaLocation="./ejemplo1.xsd">
    <persona>
        <nombre>Pedro</nombre>
        <apellidos>Ortiz Pérez</apellidos>
        <fecha_nacimiento>
            <dia>15</dia>
            <mes>8</mes>
            <año>1890</año>
        </fecha_nacimiento>
        <diaSemana>Lunes</diaSemana>
        <dni nacionalidad="España"></dni>
    </persona>
</personas>